_ID,TITLE,ISSUINGORGANIZATION,CERTIFICATE_ID,ISSUANCEDATE,EXPIRATIONDATE,DESCRIPTION,EMP_ID,APPROVAL,__V
660f8d63cf56a208f379bddc,Technical Proficiency (specific to the employee's field),Parsons Group,b11966d4-9703-4df1-a8a1-768de085910a,2000-07-02 00:00:00,2024-05-02 00:00:00,Sound front hit into fly know consider.,EMP_465,Approved,0
660f8d63cf56a208f379bddd,Adaptability,Davis and Sons,ed0d34ae-3172-498b-80f9-53f964371ea3,1984-03-02 00:00:00,2024-04-22 00:00:00,Cover could light fish you which.,EMP_466,Approved,0
660f8d63cf56a208f379bdde,Angular,"Smith, Coleman and Sampson",0d449e59-65dc-44a1-988b-60f0c0fa2017,1993-06-18 00:00:00,2024-04-19 00:00:00,Gas fire direction water manage will school.,EMP_467,Rejected,0
660f8d63cf56a208f379bddf,PyTorch,"Stuart, Clark and Martin",d298dd1d-e9fb-41b5-b665-b0ae1045fc77,1997-01-24 00:00:00,2024-04-25 00:00:00,Safe season make season position certain away.,EMP_468,Rejected,0
660f8d63cf56a208f379bde0,PyTorch,Ramirez-Lee,28fccf8d-0348-490a-9b42-e62ae34d7369,1971-03-16 00:00:00,2024-05-02 00:00:00,Away speech election nation available discuss campaign.,EMP_469,Approved,0
660f8d63cf56a208f379bde1,React.js,"Sullivan, Armstrong and Beasley",f8243300-f6de-4912-8761-7d0da6dc5186,1985-03-20 00:00:00,2024-04-21 00:00:00,Perform dog quickly section well high building.,EMP_470,Approved,0
660f8d63cf56a208f379bde2,React.js,Gross Ltd,6dd1f5ef-5151-44ac-9422-5f3999f9fa11,1981-05-24 00:00:00,2024-04-30 00:00:00,Someone thing how to able happy dinner.,EMP_471,Approved,0
660f8d63cf56a208f379bde3,MySQL,Berry and Sons,6cb95e4f-d2ed-4a17-920c-97819962bc05,2022-07-22 00:00:00,2024-04-21 00:00:00,Receive religious record.,EMP_472,Approved,0
660f8d63cf56a208f379bde4,Kubernetes,Gibbs-Burnett,6e8d0175-594f-4d0c-b782-092d3542dd69,1975-05-17 00:00:00,2024-04-27 00:00:00,Myself national worry when level professor.,EMP_473,Rejected,0
660f8d63cf56a208f379bde5,Kotlin,Pena-Navarro,85018b6e-d903-468c-a3ea-79b5ac474443,2012-01-05 00:00:00,2024-04-24 00:00:00,Firm his movie list own.,EMP_474,Rejected,0
660f8d63cf56a208f379bde6,Node.js,Richardson Group,08812013-00e2-4b0d-85be-95374f91a3ea,1988-10-02 00:00:00,2024-05-02 00:00:00,Successful if bring technology major theory seem.,EMP_475,Rejected,0
660f8d63cf56a208f379bde7,Android Studio,Miller-Shah,a0b149f3-03af-4055-92e3-f8a8a2731bd6,2023-11-19 00:00:00,2024-04-27 00:00:00,Tv beat drug direction discussion.,EMP_476,Approved,0
660f8d63cf56a208f379bde8,Adobe XD,Atkinson-Phillips,42f85d31-9237-4bf7-ac2c-11c8d63350c3,1974-03-20 00:00:00,2024-05-04 00:00:00,Shake despite charge operation ok number author.,EMP_477,Rejected,0
660f8d63cf56a208f379bde9,JIRA,Gross-Peck,ea484606-053a-4ea4-8748-8f118f98fb56,1992-02-06 00:00:00,2024-04-29 00:00:00,Guy simply determine run fast performance.,EMP_478,Rejected,0
660f8d63cf56a208f379bdea,Firebase,Cook Inc,9ab0abfc-2f7b-4a56-ae6a-98d78696aa42,1998-01-27 00:00:00,2024-04-20 00:00:00,Popular live guess age that professor mouth.,EMP_479,Rejected,0
660f8d63cf56a208f379bdeb,Time Management,Jimenez Inc,28f5b00f-5828-4a31-8ab1-2c74916c43f3,2013-09-08 00:00:00,2024-04-07 00:00:00,Source should at reason goal cell.,EMP_480,Rejected,0
660f8d63cf56a208f379bdec,Docker,Perez-Mayo,2b6969d1-5c14-4125-a0dd-9469cc964bb0,2000-04-07 00:00:00,2024-04-22 00:00:00,Name quality Congress man yes view benefit.,EMP_481,Approved,0
660f8d63cf56a208f379bded,Kotlin,Hughes-Clark,38c45e1d-d805-494b-9894-6841f8e51816,1999-04-28 00:00:00,2024-05-02 00:00:00,Back share those south teacher sit administration.,EMP_482,Approved,0
660f8d63cf56a208f379bdee,Hibernate,Clarke PLC,c508e512-2811-416a-973c-7cb533c911c7,2008-02-24 00:00:00,2024-04-12 00:00:00,Truth card kind present tree.,EMP_483,Approved,0
660f8d63cf56a208f379bdef,UI/UX Design Principles,Howard LLC,629ff0d4-5290-480c-b9d4-4a70309a94ea,1978-07-14 00:00:00,2024-04-30 00:00:00,Friend doctor herself fear job job decade.,EMP_484,Rejected,0
660f8d63cf56a208f379bdf0,Android Studio,"Shields, Santos and Myers",db04f511-6b13-48fb-9ceb-66a19b3eb498,1992-05-06 00:00:00,2024-04-20 00:00:00,Finally bank western resource send magazine thank realize.,EMP_485,Approved,0
660f8d63cf56a208f379bdf1,Networking Abilities,"Smith, Sanchez and Wolf",dfc2ce89-2552-4223-bdda-9c5cd2b69747,2000-09-14 00:00:00,2024-04-09 00:00:00,Baby whether message onto expert per certain a.,EMP_486,Approved,0
660f8d63cf56a208f379bdf2,SQL,Haas-Browning,e0da4514-0444-4958-b3d4-84cf4be9efc2,2001-06-06 00:00:00,2024-04-18 00:00:00,Add water environmental seat enter yard popular.,EMP_487,Approved,0
660f8d63cf56a208f379bdf3,Oracle,Norris LLC,939a4cc4-00ca-4cf0-a4e2-0352ddd4b115,1973-04-27 00:00:00,2024-04-09 00:00:00,Charge short study human break small or.,EMP_488,Approved,0
660f8d63cf56a208f379bdf4,Spark),Walker and Sons,298d27e5-7b8b-4272-9194-bdbb9cc8cbb3,2014-10-07 00:00:00,2024-04-09 00:00:00,Early world raise discover speak.,EMP_489,Approved,0
660f8d63cf56a208f379bdf5,IoT Development,Richard-Mcdonald,191bc6c7-09eb-4fb6-a7c4-79d766db828e,2013-12-05 00:00:00,2024-05-04 00:00:00,Civil hear member large cause recognize.,EMP_490,Approved,0
660f8d63cf56a208f379bdf6,Customer Service Skills,Dunn Ltd,c97f487c-475e-4684-9a3d-b5b75f39027b,1976-01-15 00:00:00,2024-04-18 00:00:00,Law few none detail.,EMP_491,Approved,0
660f8d63cf56a208f379bdf7,Raspberry Pi,"Simmons, Burnett and Miranda",922afde2-4dfb-4ab8-9848-706c4ddb7289,1976-11-26 00:00:00,2024-04-08 00:00:00,Congress condition plant kind tough.,EMP_492,Approved,0
660f8d63cf56a208f379bdf8,Raspberry Pi,Stephens-Farrell,cbf597a8-4fa8-4e26-9740-332d53baecb6,1993-10-19 00:00:00,2024-05-03 00:00:00,Force surface least medical.,EMP_493,Approved,0
660f8d63cf56a208f379bdf9,Decision-Making Skills,"Lowery, Lee and Baird",66f7803a-2256-47e1-980b-9eaa49adfc94,1982-04-26 00:00:00,2024-04-30 00:00:00,Beat rate onto person.,EMP_494,Approved,0
660f8d63cf56a208f379bdfa,RESTful APIs,Henry-Brooks,7752875f-82f2-49d1-ade2-b272c2778d77,2024-03-12 00:00:00,2024-05-02 00:00:00,Tree whether address issue.,EMP_495,Rejected,0
660f8d63cf56a208f379bdfb,Python,Smith Ltd,8141cd73-8acc-43fb-a11d-f76b084feaa5,2002-11-24 00:00:00,2024-04-07 00:00:00,Him glass some five public color.,EMP_496,Rejected,0
660f8d63cf56a208f379bdfc,Python,"Davis, Burns and Mosley",adbb59fd-4d6a-45d2-befb-775b47684ef3,1982-05-03 00:00:00,2024-04-18 00:00:00,Check improve child will plan.,EMP_497,Rejected,0
660f8d63cf56a208f379bdfd,AWS,Evans PLC,7f3f42be-a528-4d38-83c6-bb0d97d5308e,1994-06-22 00:00:00,2024-04-21 00:00:00,International American meeting chance.,EMP_498,Rejected,0
660f8d63cf56a208f379bdfe,Hibernate,"Little, Turner and Robertson",0ec990dc-bd68-451a-b2af-e92f24299196,1970-08-05 00:00:00,2024-04-11 00:00:00,Firm site camera.,EMP_499,Approved,0
660f8d63cf56a208f379bdff,Swift,"Smith, Williams and Bennett",61c0271d-d125-4dfd-bb03-1e2eb4420836,1998-07-08 00:00:00,2024-04-19 00:00:00,Court piece system author type you forward southern.,EMP_500,Approved,0
660f8d63cf56a208f379be00,Communication Skills,Bell-Hancock,e0f71fc0-31d5-4c0d-9b48-4df3d06e2915,2004-09-15 00:00:00,2024-04-16 00:00:00,Need success place military.,EMP_501,Approved,0
660f8d63cf56a208f379be01,RESTful APIs,Houston PLC,8c832abb-c43b-4172-99e1-8d09bb9d4386,1984-08-18 00:00:00,2024-04-28 00:00:00,Network show writer fill.,EMP_502,Rejected,0
660f8d63cf56a208f379be02,Spring Framework,"Castro, Mueller and Henderson",0e4c2553-b5e0-4791-91ba-7474a45a19bc,2004-06-23 00:00:00,2024-04-23 00:00:00,Price drive prevent most.,EMP_503,Rejected,0
660f8d63cf56a208f379be03,Adobe XD,Rodgers Inc,2296bbd3-94a4-4d72-a766-f3d064592703,1999-07-08 00:00:00,2024-05-04 00:00:00,Officer break group house price result big she.,EMP_504,Approved,0
660f8d63cf56a208f379be04,IoT Development,Thomas-Lewis,8e829c7d-f690-4104-ae77-a119c46005d2,2008-03-30 00:00:00,2024-04-28 00:00:00,Especially carry parent understand a degree.,EMP_505,Rejected,0
660f8d63cf56a208f379be05,Swift,Parker-Mason,b69872d5-5650-475f-8c1d-ac70c9766399,2003-11-11 00:00:00,2024-04-11 00:00:00,Campaign product entire green seek stand away hotel.,EMP_506,Approved,0
660f8d63cf56a208f379be06,Communication Skills,Bailey-Thomas,6e986db4-bd58-44b0-8b42-1cd1b1d2f41c,2023-09-13 00:00:00,2024-04-07 00:00:00,South anyone research hand there ability age.,EMP_507,Approved,0
660f8d63cf56a208f379be07,Google Cloud Platform,"Chandler, Wallace and Williams",d6f90d2f-8b77-42be-a9f9-4ab9aad1ac4a,2023-07-17 00:00:00,2024-04-18 00:00:00,Hot message network continue interview job risk compare.,EMP_508,Approved,0
660f8d63cf56a208f379be08,Technical Proficiency (specific to the employee's field),Oliver-Moody,94e341e3-7c97-4eca-98b6-acca7417666a,2012-01-07 00:00:00,2024-04-10 00:00:00,Skin out like everybody especially floor spend.,EMP_509,Rejected,0
660f8d63cf56a208f379be09,Scikit-learn,Gonzalez-Powell,4d65e81d-287a-4dca-9ab7-b8571eab0e95,1985-09-29 00:00:00,2024-04-24 00:00:00,Around road budget break memory this.,EMP_510,Rejected,0
660f8d63cf56a208f379be0a,Communication Skills,"Turner, Arellano and Spencer",9b2a9738-0a93-4130-9b67-4e013b84c25a,1983-09-18 00:00:00,2024-04-19 00:00:00,Response figure once cause.,EMP_511,Approved,0
660f8d63cf56a208f379be0b,Networking Abilities,"Berry, Cunningham and Weber",91ee5c24-05ca-4aa5-9f8d-35c6653e6e0c,1971-08-13 00:00:00,2024-04-07 00:00:00,Bar oil loss make early most improve.,EMP_512,Rejected,0
660f8d63cf56a208f379be0c,Communication Skills,Turner-Wilson,969a64aa-e17c-4940-b7c0-a0a3381f4161,1971-08-24 00:00:00,2024-04-20 00:00:00,Answer still benefit candidate world before.,EMP_513,Rejected,0
660f8d63cf56a208f379be0d,Teamwork and Collaboration,Flowers Inc,7fe95b8c-f55b-43b9-b1dd-0afd96c1738e,2018-09-07 00:00:00,2024-04-22 00:00:00,Resource single culture name senior.,EMP_514,Approved,0
660f8d63cf56a208f379be0e,Django,Braun PLC,70439867-92e8-4acc-87a8-f719234f977f,1975-05-26 00:00:00,2024-04-30 00:00:00,Market million their nor piece everything street.,EMP_515,Approved,0
660f8d63cf56a208f379be0f,Decision-Making Skills,"Calderon, Mitchell and Velez",015c8d33-e1d1-47a7-ba1a-7b31e1a74141,1977-01-01 00:00:00,2024-04-27 00:00:00,Risk book develop.,EMP_516,Rejected,0
660f8d63cf56a208f379be10,Attention to Detail,Salazar-Barton,3eea8419-4699-4494-a03a-464f42a2554d,1980-05-19 00:00:00,2024-04-30 00:00:00,Door increase day experience style.,EMP_517,Rejected,0
660f8d63cf56a208f379be11,JavaScript,"Carson, Mcintosh and Jones",fdcc598c-1dbf-4360-a8ea-76a7eb7f6cbe,1988-07-08 00:00:00,2024-05-01 00:00:00,Evening them allow have real Republican.,EMP_518,Approved,0
660f8d63cf56a208f379be12,Time Management,"French, Cisneros and Mendoza",73ed4c64-ba7e-461c-a6f3-cea3314fb027,2003-10-08 00:00:00,2024-05-02 00:00:00,International decision big else yet laugh.,EMP_519,Approved,0
660f8d63cf56a208f379be13,Google Cloud Platform,Lopez-Dunlap,ed24ec86-562b-4357-878e-4a434ba3148a,2003-04-13 00:00:00,2024-04-30 00:00:00,Back act paper rest opportunity.,EMP_520,Rejected,0
660f8d63cf56a208f379be14,Adobe XD,"Brown, Davis and Wood",265f3fa5-0a07-4edc-8046-42f02a3c2084,1995-04-27 00:00:00,2024-04-14 00:00:00,South baby us purpose health natural man.,EMP_521,Rejected,0
660f8d63cf56a208f379be15,Arduino,Chambers and Sons,bdbaff69-f69d-44a8-86ea-12bad8e25c35,2022-03-27 00:00:00,2024-04-10 00:00:00,Participant manage live test.,EMP_522,Approved,0
660f8d63cf56a208f379be16,React.js,"Williams, Costa and Gardner",c9d74ede-6596-4349-8c3d-ccec2aea0bcc,1999-09-09 00:00:00,2024-05-01 00:00:00,There bed direction draw bar.,EMP_523,Approved,0
660f8d63cf56a208f379be17,Raspberry Pi,"Steele, Craig and Wells",3e9e1151-0a4d-43ed-8b48-1bc7f75c32ae,1989-12-20 00:00:00,2024-05-02 00:00:00,Property middle court base.,EMP_524,Approved,0
660f8d63cf56a208f379be18,Hibernate,Rivera PLC,37174a71-2a4a-4686-b4c4-23356c86d333,1985-02-25 00:00:00,2024-04-06 00:00:00,Inside specific evening glass development language official.,EMP_525,Approved,0
660f8d63cf56a208f379be19,Kotlin,Young-Adkins,edf02c72-ff91-4bea-b8c8-664edbe4e2c1,2014-10-12 00:00:00,2024-04-23 00:00:00,Not source attack poor sense.,EMP_526,Approved,0
660f8d63cf56a208f379be1a,Express.js,Perkins-Castillo,893f1f71-0c6d-48d5-9618-93557ac64f02,1980-09-08 00:00:00,2024-04-06 00:00:00,Decade dark style very lawyer state agreement.,EMP_527,Approved,0
660f8d63cf56a208f379be1b,Selenium,Cox-Byrd,1d1d7883-9b74-40a6-aa88-7dde698b617a,1973-12-17 00:00:00,2024-05-04 00:00:00,Next rest news reduce easy leader fear.,EMP_528,Rejected,0
660f8d63cf56a208f379be1c,Leadership Abilities,"Harrison, Wilson and Cook",f0edea5a-9cae-48c7-942b-e05571bed32b,2013-12-03 00:00:00,2024-04-21 00:00:00,Reality college blood line life past.,EMP_529,Approved,0
660f8d63cf56a208f379be1d,RESTful APIs,Arnold LLC,eb9d8eac-497a-4735-8fe1-ce8ee686931f,2008-10-03 00:00:00,2024-04-20 00:00:00,Thought bar manage admit history perhaps.,EMP_530,Rejected,0
660f8d63cf56a208f379be1e,Arduino,Houston-Taylor,800b6f8e-35e7-4341-937f-aa95cbe5c7d8,2002-04-24 00:00:00,2024-04-22 00:00:00,Sort interesting company team boy free study.,EMP_531,Rejected,0
660f8d63cf56a208f379be1f,Spark),"Simmons, Johnson and Tucker",aa6e18b1-d900-4814-9d01-64312ae14645,1991-02-02 00:00:00,2024-04-10 00:00:00,Per nothing my skin artist measure official head.,EMP_532,Approved,0
660f8d63cf56a208f379be20,Android Studio,Ramirez-Hayes,57496b8b-9037-404a-9cf8-e3fc0a4f2058,1980-02-10 00:00:00,2024-05-02 00:00:00,Discussion table follow race.,EMP_533,Rejected,0
660f8d63cf56a208f379be21,MongoDB,"Larson, Montoya and Shaw",81d878ac-95c0-4f04-93b1-491984da9fc6,2008-05-31 00:00:00,2024-04-23 00:00:00,Employee goal break send.,EMP_534,Rejected,0
660f8d63cf56a208f379be22,Swift,Cunningham-Mcdaniel,b0955781-021a-4b71-9b16-3aa516665587,1973-10-14 00:00:00,2024-04-30 00:00:00,Official allow drive whole.,EMP_535,Approved,0
660f8d63cf56a208f379be23,Node.js,"Rodriguez, Liu and Walters",ea916312-6f30-4ff3-a4b0-27feefd9d956,1988-09-15 00:00:00,2024-04-29 00:00:00,Network population after human write chair value team.,EMP_536,Rejected,0
660f8d63cf56a208f379be24,Creativity and Innovation,"Smith, Johnson and Vargas",5eabb2c6-e5db-432a-ae28-e652f37bef47,1988-04-20 00:00:00,2024-04-12 00:00:00,New care maybe history position clear.,EMP_537,Rejected,0
660f8d63cf56a208f379be25,Spring Framework,Jenkins LLC,875ddf8e-052b-4482-a98f-930a7905365e,1974-08-15 00:00:00,2024-04-12 00:00:00,Fear instead sport under born art enter success.,EMP_538,Approved,0
660f8d63cf56a208f379be26,Kubernetes,Knight Ltd,ee37bf2a-d4ff-4296-9e2a-46f1a09626b2,1983-03-08 00:00:00,2024-04-18 00:00:00,Result factor move all everyone.,EMP_539,Rejected,0
660f8d63cf56a208f379be27,Research Skills,Wells and Sons,ea2e8af4-554e-4a0e-82cb-b27d27322cc2,1977-01-23 00:00:00,2024-04-07 00:00:00,Very me wait evening although.,EMP_540,Approved,0
660f8d63cf56a208f379be28,Git,Hall Group,92e11c7b-335e-4d91-9a52-0500358e164b,2012-02-28 00:00:00,2024-04-21 00:00:00,Maintain which simply expert officer.,EMP_541,Approved,0
660f8d63cf56a208f379be29,Attention to Detail,Odonnell Inc,6f3d194f-9c37-45ad-b345-8972ab1ceb41,1974-10-24 00:00:00,2024-04-26 00:00:00,Fall authority manager field fact population soldier.,EMP_542,Approved,0
660f8d63cf56a208f379be2a,Decision-Making Skills,"Fleming, Watson and Lawrence",fc4f4249-4764-48d3-a6f8-036909d89996,1997-12-08 00:00:00,2024-04-10 00:00:00,Action talk support back.,EMP_543,Approved,0
660f8d63cf56a208f379be2b,Technical Proficiency (specific to the employee's field),Young Ltd,3ccc5e6f-daf1-4a74-bf44-8bd1725fcd2f,1989-10-03 00:00:00,2024-04-07 00:00:00,Turn set small manager direction man.,EMP_544,Approved,0
660f8d63cf56a208f379be2c,Analytical Skills,"Clayton, Todd and Cole",dc42bbd0-614c-4e59-9d9f-2a362f6ad12c,2008-07-11 00:00:00,2024-04-06 00:00:00,Minute effect science turn quickly several music.,EMP_545,Approved,0
660f8d63cf56a208f379be2d,Adaptability,Lopez-Lawrence,286b5d56-2294-4aad-9449-b1d66cccef30,1978-02-08 00:00:00,2024-04-20 00:00:00,Role throughout industry yet time development want.,EMP_546,Approved,0
660f8d63cf56a208f379be2e,Android Studio,Clarke-Rhodes,57c3aa70-66a8-48df-9f90-e17e352bdd24,2024-04-01 00:00:00,2024-04-20 00:00:00,Than hundred statement than hundred itself tax enter.,EMP_547,Approved,0
660f8d63cf56a208f379be2f,Angular,Navarro-Barr,2d3caa4b-aee2-4bfe-b16b-e81e2d7a5f01,2019-05-11 00:00:00,2024-04-29 00:00:00,Deal concern campaign product break though.,EMP_548,Approved,0
660f8d63cf56a208f379be30,Kubernetes,"Jones, Brown and Baker",b8b386ad-2764-47ff-a0bd-10c328af5cf1,1978-08-09 00:00:00,2024-04-06 00:00:00,Thousand job their put.,EMP_549,Approved,0
660f8d63cf56a208f379be31,Adaptability,Sims Ltd,a65a124a-cd2a-4395-889c-d3afebde29d0,2007-09-22 00:00:00,2024-04-09 00:00:00,Somebody particularly common table focus record.,EMP_550,Rejected,0
660f8d63cf56a208f379be32,Analytical Skills,Browning Ltd,339b3520-8900-48fc-bba0-19393e6c28f8,2020-03-04 00:00:00,2024-04-10 00:00:00,Above ask catch start member clearly thus.,EMP_551,Rejected,0
660f8d63cf56a208f379be33,Oracle,Mcdonald-Foster,4febf4b9-e14e-4239-aa90-7dc2f66a19a7,2022-06-07 00:00:00,2024-04-16 00:00:00,Though assume despite decade training ground.,EMP_552,Approved,0
660f8d63cf56a208f379be34,PyTorch,"Martin, Brown and Simpson",917fa155-a7a8-44e8-bccf-59d160226c8b,2016-01-06 00:00:00,2024-04-28 00:00:00,What car big next.,EMP_553,Rejected,0
660f8d63cf56a208f379be35,Flask,Perez-Adams,9716b04b-fb14-4c2b-af55-6f0569542020,1984-10-11 00:00:00,2024-04-24 00:00:00,Very public cell culture choice happen.,EMP_554,Rejected,0
660f8d63cf56a208f379be36,Spring Framework,Bartlett-Mitchell,0ff6f43f-7e69-47c2-a310-d1bf7787a1a8,1995-02-12 00:00:00,2024-04-18 00:00:00,Write some wear walk.,EMP_555,Rejected,0
660f8d63cf56a208f379be37,Arduino,Rios and Sons,80d116af-951c-4611-9000-96b135953bec,1974-05-02 00:00:00,2024-04-24 00:00:00,Name result environment share which last dinner.,EMP_556,Rejected,0
660f8d63cf56a208f379be38,Docker,"Hess, Novak and Gould",4f0a1682-d884-4026-ab0b-5d7045a4757a,1998-03-04 00:00:00,2024-04-19 00:00:00,View house simple whatever.,EMP_557,Rejected,0
660f8d63cf56a208f379be39,React.js,Sullivan Ltd,a7193ce6-cca0-4c90-a4dd-e6a57b00db95,2015-06-03 00:00:00,2024-04-15 00:00:00,Think card evidence TV employee indeed focus.,EMP_558,Rejected,0
660f8d63cf56a208f379be3a,Angular,Hogan PLC,bed0c963-9639-492a-b84a-a277f1651ade,1970-09-08 00:00:00,2024-04-27 00:00:00,Never someone chair toward that officer want.,EMP_559,Rejected,0
660f8d63cf56a208f379be3b,TensorFlow,Perez Group,467d7e9b-4835-45a3-aa0e-2f4421c33beb,1995-09-19 00:00:00,2024-04-16 00:00:00,Blue gas off area season world.,EMP_560,Approved,0
660f8d63cf56a208f379be3c,Customer Service Skills,Spencer LLC,8637fda9-7296-429f-ad58-c46caa8fe3df,2012-05-17 00:00:00,2024-04-09 00:00:00,Once meet management hard outside security smile.,EMP_561,Rejected,0
660f8d63cf56a208f379be3d,Figma,Reyes-Simmons,82cc46ae-e33b-42df-a62f-1b578d765b9a,2006-08-10 00:00:00,2024-05-04 00:00:00,Good begin range.,EMP_562,Rejected,0
660f8d63cf56a208f379be3e,HTML/CSS,Ross and Sons,ab03ba53-73a5-46e7-a81d-87e7a546cdcc,2006-04-10 00:00:00,2024-04-17 00:00:00,Listen want reason she though will.,EMP_563,Rejected,0
660f8d63cf56a208f379be3f,Computer Vision,"Pope, Joseph and Pugh",2bc22bf3-cf26-475c-9da4-9f7b74e71763,1995-06-23 00:00:00,2024-04-26 00:00:00,Prove yourself individual while.,EMP_564,Rejected,0
660f8d63cf56a208f379be40,Hibernate,Schmidt Group,f03a3166-bc13-47b5-ab30-1f4933b8ac90,1977-06-23 00:00:00,2024-04-08 00:00:00,Fight today determine according.,EMP_565,Rejected,0
660f8d63cf56a208f379be41,Jenkins,Lopez PLC,c3503fd6-0f0b-4863-bf1f-a34c495dcf9c,1977-11-06 00:00:00,2024-04-20 00:00:00,Perhaps team doctor enough news suffer itself.,EMP_566,Rejected,0
660f8d63cf56a208f379be42,Spring Framework,Hines Group,a3d484af-760d-4fea-a61f-02ddb64f6342,1978-12-07 00:00:00,2024-04-18 00:00:00,Property game behavior explain.,EMP_567,Approved,0
660f8d63cf56a208f379be43,AWS,Palmer LLC,ba4fe851-56dd-413a-b8b8-f07f5f67242c,1971-12-08 00:00:00,2024-04-21 00:00:00,They deal forget sign entire often.,EMP_568,Rejected,0
660f8d63cf56a208f379be44,Git,Russo-White,cd9cba3c-c814-4406-8a95-e8c84362231f,1974-06-03 00:00:00,2024-04-24 00:00:00,Policy pretty truth least.,EMP_569,Rejected,0
660f8d63cf56a208f379be45,Decision-Making Skills,Romero Group,22c2b15b-1ed5-4ad2-9cb3-cb7e52741a27,1982-01-19 00:00:00,2024-04-11 00:00:00,East become owner down wall sister.,EMP_570,Rejected,0
660f8d63cf56a208f379be46,Decision-Making Skills,Hancock Ltd,de45d72a-336e-4e0b-b6b6-612eefc5ad76,1970-09-02 00:00:00,2024-04-20 00:00:00,Rate them home head here foreign take.,EMP_571,Rejected,0
660f8d63cf56a208f379be47,Decision-Making Skills,Zimmerman Inc,649103f8-fb91-4ac8-b55c-f8ac0db11690,2004-08-11 00:00:00,2024-04-19 00:00:00,Station require security.,EMP_572,Rejected,0
660f8d63cf56a208f379be48,MongoDB,Cameron Ltd,219b467c-9070-4714-91b0-09c753cdb064,1984-12-25 00:00:00,2024-05-02 00:00:00,Study daughter reduce which.,EMP_573,Approved,0
660f8d63cf56a208f379be49,Research Skills,Fox PLC,0fe5b109-2e9c-4ed8-a946-c35b83f895d5,2011-09-29 00:00:00,2024-05-01 00:00:00,Before whole me.,EMP_574,Rejected,0
660f8d63cf56a208f379be4a,Express.js,Smith Ltd,507400d1-aa59-447b-8066-16d2fc3b98de,2002-05-23 00:00:00,2024-04-24 00:00:00,Military happen want marriage bit.,EMP_575,Rejected,0
660f8d63cf56a208f379be4b,Figma,Green-Jones,cad59beb-2401-419c-9bd9-113507ca5c62,2007-12-23 00:00:00,2024-04-06 00:00:00,Development class them article.,EMP_576,Approved,0
660f8d63cf56a208f379be4c,Raspberry Pi,Rivers-Edwards,c9afcdec-e0c9-4453-8834-fd95a90e5de8,1994-10-27 00:00:00,2024-04-28 00:00:00,Find seven as eight fight.,EMP_577,Rejected,0
660f8d63cf56a208f379be4d,Project Management Skills,Gaines-Rhodes,8c722908-95ab-4f4c-bc49-8ab9741198ae,1987-01-09 00:00:00,2024-05-03 00:00:00,Pattern popular ok accept each call clear real.,EMP_578,Approved,0
660f8d63cf56a208f379be4e,Analytical Skills,Wong Group,0e5cd793-c1bf-4420-8e61-bd432067a907,1996-02-22 00:00:00,2024-04-16 00:00:00,Another himself national central.,EMP_579,Rejected,0
660f8d63cf56a208f379be4f,Jenkins,Madden-Hansen,8791413d-d03d-4e35-8a5e-f91ea0d8447a,1987-08-08 00:00:00,2024-04-13 00:00:00,Return see statement seat brother gun president nothing.,EMP_580,Rejected,0
660f8d63cf56a208f379be50,Spring Framework,Carpenter Ltd,be78540a-f3ca-4025-8658-ebb61452d0a4,2007-12-18 00:00:00,2024-04-16 00:00:00,Art four use bad certain price name.,EMP_581,Rejected,0
660f8d63cf56a208f379be51,HTML/CSS,"Lee, Watson and Nelson",b5838baa-8726-4ae2-83b5-24f225684874,2023-01-24 00:00:00,2024-04-19 00:00:00,Government occur news artist.,EMP_582,Rejected,0
660f8d63cf56a208f379be52,PyTorch,Baker Inc,4f82dfbb-fabc-4dc2-addc-384f4aec55d4,2003-02-18 00:00:00,2024-04-28 00:00:00,Hear green for simple federal.,EMP_583,Approved,0
660f8d63cf56a208f379be53,JavaScript,Saunders and Sons,07f8ddfe-119f-419d-87d6-b5de534cc802,1983-11-21 00:00:00,2024-04-12 00:00:00,Different health seem teacher cut begin difficult.,EMP_584,Rejected,0
660f8d63cf56a208f379be54,PostgreSQL,King Inc,039d5495-b0f3-4f28-a87b-ae3f93cd8e31,1971-06-28 00:00:00,2024-04-17 00:00:00,Forget off wait.,EMP_585,Rejected,0
660f8d63cf56a208f379be55,Teamwork and Collaboration,Paul Ltd,d723aade-f920-4430-a254-70ce4512dbdf,2014-10-13 00:00:00,2024-04-14 00:00:00,Realize lead list mention black son.,EMP_586,Approved,0
660f8d63cf56a208f379be56,Oracle,"Garner, Harris and Garcia",3d84c4ec-cd5f-4435-b625-2c6c0965edd9,2005-12-04 00:00:00,2024-05-02 00:00:00,Likely get against music.,EMP_587,Approved,0
660f8d63cf56a208f379be57,Teamwork and Collaboration,Davis-Harmon,9e6e7784-9f78-49d6-9957-7da8f56c1d14,1977-11-01 00:00:00,2024-04-28 00:00:00,Listen believe general thought.,EMP_588,Approved,0
660f8d63cf56a208f379be58,MySQL,Long Ltd,67d53559-6498-44a6-9994-45542469ddf0,1983-07-10 00:00:00,2024-04-21 00:00:00,Officer his view respond measure similar.,EMP_589,Approved,0
660f8d63cf56a208f379be59,Arduino,"Trevino, Clark and Ramsey",71974960-330d-476f-9070-3a366a28dfd9,2012-10-22 00:00:00,2024-04-29 00:00:00,Seat yard with those out provide.,EMP_590,Approved,0
660f8d63cf56a208f379be5a,JavaScript,Peterson-Hansen,b5e28c37-17d6-4b60-8359-158474c8cad1,1996-06-19 00:00:00,2024-04-26 00:00:00,Yes prepare Mr ground blue early stay.,EMP_591,Rejected,0
660f8d63cf56a208f379be5b,Natural Language Processing (NLP),"Merritt, Marsh and Carey",d40fedaa-e68c-4ef8-a47b-c6b9edfddd56,1980-05-03 00:00:00,2024-05-02 00:00:00,Even east eat.,EMP_592,Rejected,0
660f8d63cf56a208f379be5c,Natural Language Processing (NLP),Perkins-Lee,8654b070-3f09-4ef9-bdcb-0c64f402ae44,1980-09-08 00:00:00,2024-05-04 00:00:00,Degree try study focus simple nice a.,EMP_593,Rejected,0
660f8d63cf56a208f379be5d,Problem-Solving Skills,Coleman and Sons,7447dd90-7972-4052-8338-b3b143417d83,2015-02-04 00:00:00,2024-04-22 00:00:00,Structure first head election.,EMP_594,Approved,0
660f8d63cf56a208f379be5e,Jenkins,Jones-Ramirez,a7c035e3-e7c2-45eb-ad74-2e5488bf71f6,2000-10-02 00:00:00,2024-05-01 00:00:00,Risk early call fill computer source.,EMP_595,Approved,0
660f8d63cf56a208f379be5f,Xcode,"Williams, Fry and Garcia",d4261a91-af1d-4f4f-9c8a-1e8c8f1cc246,2018-12-08 00:00:00,2024-05-02 00:00:00,Prepare apply expert blood point.,EMP_596,Rejected,0
660f8d63cf56a208f379be60,Analytical Skills,"Flores, Herman and Hernandez",6d1e9a12-f68d-4a21-9fa0-c6a488b2f534,1995-04-08 00:00:00,2024-04-08 00:00:00,Space itself my action with her.,EMP_597,Approved,0
660f8d63cf56a208f379be61,Project Management Skills,Tapia-Crawford,adafa127-f230-4258-8490-486c31673a85,1991-04-29 00:00:00,2024-04-22 00:00:00,Summer window foreign character parent.,EMP_598,Rejected,0
660f8d63cf56a208f379be62,Oracle,Wright LLC,eb963fe3-d2d6-499c-9ce3-aa9accf89919,1975-03-08 00:00:00,2024-04-15 00:00:00,Quite turn or most health scientist.,EMP_599,Rejected,0
660f8d63cf56a208f379be63,RESTful APIs,Vasquez PLC,0e8ce07e-ce4b-4ee2-a64a-7c10bf0b03bd,1976-07-11 00:00:00,2024-05-01 00:00:00,Sometimes treat red cold million.,EMP_600,Rejected,0
