_ID,TITLE,ISSUINGORGANIZATION,CERTIFICATE_ID,ISSUANCEDATE,EXPIRATIONDATE,DESCRIPTION,EMP_ID,APPROVAL,__V
660f8d63cf56a208f379b916,Attention to Detail,Simmons-Sims,5d7faddd-c95e-421c-9db2-1217f37363c5,2005-12-24 00:00:00,2024-04-27 00:00:00,Two rich soon value century.,EMP_237,Approved,0
660f8d63cf56a208f379b917,Natural Language Processing (NLP),Higgins-Johnson,6a9e9feb-2559-442e-8ee0-140bdfc6c8b2,1993-03-15 00:00:00,2024-04-30 00:00:00,Concern good suddenly may.,EMP_238,Rejected,0
660f8d63cf56a208f379b918,GraphQL,Lopez-Lowe,7aa34936-0f1c-4327-99d0-c39fdf0c515f,1996-05-19 00:00:00,2024-04-21 00:00:00,Ready network plant detail.,EMP_239,Rejected,0
660f8d63cf56a208f379b919,Networking Abilities,"Copeland, Myers and Barnes",e12edd91-d574-4d98-bd97-0cd94b28b88d,2017-06-22 00:00:00,2024-04-26 00:00:00,Late near tough care able.,EMP_240,Rejected,0
660f8d63cf56a208f379b91a,HTML/CSS,Johnson-Bray,ce508515-28fa-4eca-a02b-48f017c1584c,1995-05-28 00:00:00,2024-04-16 00:00:00,Mean reach tax amount standard never staff week.,EMP_241,Approved,0
660f8d63cf56a208f379b91b,Express.js,"Perez, Bennett and Morrison",ea9cb062-51db-4bd6-8404-af5e717678d7,1992-09-07 00:00:00,2024-04-14 00:00:00,Draw south culture hundred.,EMP_242,Approved,0
660f8d63cf56a208f379b91c,Ethereum),Blanchard Ltd,ec8e97fc-fc89-4e12-aeb8-7d94ba230849,2010-10-15 00:00:00,2024-04-15 00:00:00,Memory million laugh majority near.,EMP_243,Approved,0
660f8d63cf56a208f379b91d,Selenium,Calderon-Gill,635bdab3-26e8-4f4f-9f76-d4fa37480c22,2014-05-12 00:00:00,2024-04-08 00:00:00,Bank time movie.,EMP_244,Approved,0
660f8d63cf56a208f379b91e,Problem-Solving Skills,"Ellison, Johnson and Blevins",f9854606-8215-4437-aa31-7e741c457615,2016-09-26 00:00:00,2024-04-24 00:00:00,Ahead listen recently education vote.,EMP_245,Rejected,0
660f8d63cf56a208f379b91f,Oracle,Jackson Inc,dd35f361-c1e0-45b6-930b-2dcfeaba7ece,2023-12-11 00:00:00,2024-04-22 00:00:00,Wind front above start drop hour miss.,EMP_246,Rejected,0
660f8d63cf56a208f379b920,Ethereum),"Wong, Warner and Vega",b38f7543-cd7d-4480-9d60-5c5711d1e395,1970-01-19 00:00:00,2024-04-09 00:00:00,Community majority several support I pass.,EMP_247,Approved,0
660f8d63cf56a208f379b921,Raspberry Pi,"Hughes, Johnson and Richards",f70b6585-62b2-4c5c-a631-a87bedbcb1a7,1987-02-13 00:00:00,2024-04-28 00:00:00,New join work lose American authority rise.,EMP_248,Rejected,0
660f8d63cf56a208f379b922,Spring Framework,Crawford-Thomas,f6ffddf3-8bf4-4ac8-bb61-020a3d40b431,1984-10-03 00:00:00,2024-05-01 00:00:00,Read plant two reach different attorney direction.,EMP_249,Rejected,0
660f8d63cf56a208f379b923,IoT Development,Olson-Underwood,021b98d4-f62c-4698-afc1-733431e025ff,1989-11-28 00:00:00,2024-04-20 00:00:00,Civil garden former idea fight kid positive.,EMP_250,Approved,0
660f8d63cf56a208f379b924,Python,"Watkins, Harris and Santiago",75905aac-1e96-40c8-b412-1dedaa9ed86d,2022-09-24 00:00:00,2024-04-21 00:00:00,Two serious very property character impact per.,EMP_251,Approved,0
660f8d63cf56a208f379b925,Android Studio,Allen-Rollins,d6df871b-7731-4ac8-b587-86662c2bccd1,1989-01-29 00:00:00,2024-04-15 00:00:00,Wife name threat space.,EMP_252,Rejected,0
660f8d63cf56a208f379b926,Decision-Making Skills,Garcia-Reyes,b4a3470e-c837-4e00-bf0a-264c8ead3e4a,2013-01-09 00:00:00,2024-04-15 00:00:00,Appear north company build table sing.,EMP_253,Rejected,0
660f8d63cf56a208f379b927,Decision-Making Skills,Walker and Sons,6a737e48-6912-4a08-be24-6cb3ffd7a679,1972-01-30 00:00:00,2024-05-03 00:00:00,Father especially person walk right place act support.,EMP_254,Rejected,0
660f8d63cf56a208f379b928,Technical Proficiency (specific to the employee's field),Miller-Bailey,a5a85158-b972-4187-adf1-b7cb44f9f150,1982-08-07 00:00:00,2024-04-08 00:00:00,Trade anything smile military activity feel available out.,EMP_255,Rejected,0
660f8d63cf56a208f379b929,JavaScript,Robbins-Sanchez,666cca1b-a416-4a4d-a7c9-2e0885244a39,2014-01-05 00:00:00,2024-04-12 00:00:00,Teacher middle star current box property discuss candidate.,EMP_256,Approved,0
660f8d63cf56a208f379b92a,Jenkins,Hunt-Gonzalez,24c2a314-9886-4a8d-a3dc-672b346e04ec,2023-03-28 00:00:00,2024-04-06 00:00:00,Likely next word protect sign kind western.,EMP_257,Rejected,0
660f8d63cf56a208f379b92b,Spark),Choi-Jones,dc1f24cf-ae58-499b-b8c0-ef7536adde99,2008-12-15 00:00:00,2024-04-30 00:00:00,Lot build address large.,EMP_258,Approved,0
660f8d63cf56a208f379b92c,Android Studio,"Jackson, House and Lopez",d92c29b5-9c1c-4d14-9962-83dae8af9b7f,2008-11-27 00:00:00,2024-04-07 00:00:00,Kid forward final usually.,EMP_259,Approved,0
660f8d63cf56a208f379b92d,Communication Skills,"Gray, George and Benson",29c08a7e-d771-4cee-b5fe-4ddf8df56413,2002-01-02 00:00:00,2024-04-25 00:00:00,Dog large near oil skin factor study.,EMP_260,Rejected,0
660f8d63cf56a208f379b92e,JavaScript,Boyd PLC,573c9788-57a1-480a-9740-1258e419c205,1980-10-31 00:00:00,2024-04-07 00:00:00,Teach owner discussion.,EMP_261,Rejected,0
660f8d63cf56a208f379b92f,Customer Service Skills,Foster-Gonzalez,e81b76b2-027a-43e4-91c1-04d31fe76cd4,1978-10-16 00:00:00,2024-04-09 00:00:00,Chair since network Republican school.,EMP_262,Approved,0
660f8d63cf56a208f379b930,Google Cloud Platform,"Singh, Moore and Williams",f4cf1d6f-15c8-4d10-8828-1c3dc9f39603,1995-11-07 00:00:00,2024-04-18 00:00:00,Yeah defense agree significant officer.,EMP_263,Approved,0
660f8d63cf56a208f379b931,Scikit-learn,Taylor-Murphy,2fdee55c-6e1c-4e12-9e89-575fd3a4d9a4,2004-06-20 00:00:00,2024-04-14 00:00:00,Than check defense morning best lawyer book.,EMP_264,Rejected,0
660f8d63cf56a208f379b932,Express.js,Brown Group,bf5b559a-dc5a-413e-abe3-d50edd9da24c,1985-04-20 00:00:00,2024-04-14 00:00:00,Recognize strategy management wish tough my bar question.,EMP_265,Rejected,0
660f8d63cf56a208f379b933,Big Data Technologies (Hadoop,"Oneal, Yang and Wright",082cf679-4b08-435c-b44d-dab378f750aa,2022-10-28 00:00:00,2024-04-15 00:00:00,Difference talk tend perhaps relationship.,EMP_266,Approved,0
660f8d63cf56a208f379b934,Raspberry Pi,Brown PLC,f144544f-9fe8-467f-9002-adc22fdfe9e0,2003-01-08 00:00:00,2024-04-19 00:00:00,Up national effort kid medical form central.,EMP_267,Approved,0
660f8d63cf56a208f379b935,Project Management Skills,Garrison PLC,ca3ed619-bfb3-4d60-ade6-fc1a7b528781,2015-11-29 00:00:00,2024-04-13 00:00:00,Land building positive those officer dream.,EMP_268,Rejected,0
660f8d63cf56a208f379b936,Problem-Solving Skills,"Hill, Miles and Smith",34b1a09b-4953-4ddf-8843-7592393067e1,1996-03-01 00:00:00,2024-04-12 00:00:00,College space policy teacher control.,EMP_269,Rejected,0
660f8d63cf56a208f379b937,Adaptability,Bowers Ltd,b1ee05b2-a0ac-4ab0-b861-57e186f10621,2021-07-07 00:00:00,2024-04-21 00:00:00,Lose industry song wife one eye nature my.,EMP_270,Approved,0
660f8d63cf56a208f379b938,Azure,Brown-Moody,94bb9596-91a8-4121-ab76-d117021a2926,2014-10-06 00:00:00,2024-04-13 00:00:00,Serious skin clear note phone himself.,EMP_271,Rejected,0
660f8d63cf56a208f379b939,Angular,Ryan and Sons,51d2f951-5348-40f5-9321-d0ca95b8397c,1994-01-14 00:00:00,2024-04-14 00:00:00,Write American actually have.,EMP_272,Approved,0
660f8d63cf56a208f379b93a,Figma,Phillips Ltd,ab389779-0fd5-442c-9bb7-f5cdf3fa597e,1992-02-19 00:00:00,2024-04-29 00:00:00,National southern official painting work.,EMP_273,Rejected,0
660f8d63cf56a208f379b93b,UI/UX Design Principles,Marshall Ltd,600b7e60-ba34-4f9f-b03c-2bd20fdfd474,1996-01-11 00:00:00,2024-04-13 00:00:00,Picture development husband involve son high new.,EMP_274,Approved,0
660f8d63cf56a208f379b93c,Networking Abilities,"Scott, Chandler and Dunn",c5009aa5-5a52-4f28-ac18-475030cb1de9,2017-06-25 00:00:00,2024-04-28 00:00:00,Half leg also sort.,EMP_275,Approved,0
660f8d63cf56a208f379b93d,Scikit-learn,Keller PLC,2918137c-414f-4667-917a-2a5ffdbfc9aa,1985-08-20 00:00:00,2024-04-27 00:00:00,Trip who stop your.,EMP_276,Approved,0
660f8d63cf56a208f379b93e,Big Data Technologies (Hadoop,Santiago-Davis,ca78d382-b034-46f5-b68b-df10fe8cac5b,1997-04-06 00:00:00,2024-04-09 00:00:00,After decision experience sign hit.,EMP_277,Rejected,0
660f8d63cf56a208f379b93f,Spring Framework,Sparks-Bennett,98559586-7fd7-4985-9669-c57ee0eeedf5,2006-11-18 00:00:00,2024-04-25 00:00:00,Cause American plan care.,EMP_278,Approved,0
660f8d63cf56a208f379b940,MySQL,Hartman PLC,0e87d30c-c656-4c65-971c-cf913d6d2257,2001-10-01 00:00:00,2024-04-29 00:00:00,Man instead manager before the discussion start.,EMP_279,Rejected,0
660f8d63cf56a208f379b941,Firebase,Perkins-Long,6b59ff18-f79f-4ba8-b44c-2ee531529210,2004-06-10 00:00:00,2024-04-06 00:00:00,Its throw now election industry win difficult just.,EMP_280,Approved,0
660f8d63cf56a208f379b942,Decision-Making Skills,"Reilly, Johnson and Fuller",5d238a3c-84c3-4ffd-9545-c7d153ccee2c,2011-09-13 00:00:00,2024-04-18 00:00:00,Section high light watch our back.,EMP_281,Rejected,0
660f8d63cf56a208f379b943,PyTorch,"Velez, Barrett and Trujillo",f9feecfc-2eda-467f-9c63-3c7bdf2ff2e2,1974-11-17 00:00:00,2024-04-09 00:00:00,Build hour various per within.,EMP_282,Rejected,0
660f8d63cf56a208f379b944,Oracle,Phelps Group,92dc1974-00d0-47f3-ba66-25758fdf38cd,1983-11-03 00:00:00,2024-04-23 00:00:00,Event director television car believe until it.,EMP_283,Rejected,0
660f8d63cf56a208f379b945,Attention to Detail,"Stephens, Powell and Perry",8b5e273d-cc4f-412f-954d-77f3e9f6f944,1976-12-16 00:00:00,2024-04-07 00:00:00,Crime group establish southern interesting as.,EMP_284,Rejected,0
660f8d63cf56a208f379b946,Git,Harrison and Sons,131fb3bc-ee2d-4872-acc2-0118ed98f0f3,2019-03-19 00:00:00,2024-04-22 00:00:00,Writer special little everything within draw state still.,EMP_285,Approved,0
660f8d63cf56a208f379b947,Firebase,Smith Inc,747ae65e-c441-40de-a1e8-ff4caf8421f4,1976-05-25 00:00:00,2024-05-03 00:00:00,Consider big act letter during each.,EMP_286,Approved,0
660f8d63cf56a208f379b948,AWS,Burgess PLC,1d1898f7-744a-4bee-a621-483d9678dd71,2009-03-16 00:00:00,2024-04-09 00:00:00,Continue agree cultural edge minute.,EMP_287,Rejected,0
660f8d63cf56a208f379b949,React.js,Nelson-Mullins,bac9fe1c-03d1-45ce-a656-5c580aded057,1990-07-04 00:00:00,2024-04-28 00:00:00,Act thank as thus us security consider.,EMP_288,Rejected,0
660f8d63cf56a208f379b94a,MongoDB,Blake-Brewer,4dc2e085-eb00-4a35-a70a-8faced78919b,1978-10-11 00:00:00,2024-04-25 00:00:00,Child morning order always hit new chair.,EMP_289,Rejected,0
660f8d63cf56a208f379b94b,Django,"Mckay, Martin and Davenport",bd1990f6-bf77-4584-af24-cbb94d8ff819,1972-08-09 00:00:00,2024-04-23 00:00:00,Face experience off serve land market street.,EMP_290,Approved,0
660f8d63cf56a208f379b94c,Analytical Skills,Smith Group,0ead9188-f8db-41a9-b675-de5eec7a67c3,1972-07-25 00:00:00,2024-04-23 00:00:00,Concern member language majority agent.,EMP_291,Rejected,0
660f8d63cf56a208f379b94d,Swift,"Lewis, Rodriguez and Martin",e7a665f7-03be-4581-92b9-9c4ee4fd71c0,1977-02-11 00:00:00,2024-04-20 00:00:00,Against care important say series win area result.,EMP_292,Approved,0
660f8d63cf56a208f379b94e,Communication Skills,Harris-Peterson,1b8b4811-69ff-4200-aea5-d5aa2ed9201b,2004-09-08 00:00:00,2024-04-26 00:00:00,Maybe class toward.,EMP_293,Rejected,0
660f8d63cf56a208f379b94f,Decision-Making Skills,Griffin-Garcia,60267d69-1ef0-4bce-8441-b98d73f295ac,2011-11-29 00:00:00,2024-05-03 00:00:00,Listen travel available safe heart interesting break.,EMP_294,Rejected,0
660f8d63cf56a208f379b950,Selenium,Russell-Ruiz,133101a4-1514-4fbd-85b9-34791f54657e,2006-02-09 00:00:00,2024-04-14 00:00:00,Though soon cause coach.,EMP_295,Approved,0
660f8d63cf56a208f379b951,Flask,Silva and Sons,a4b9a177-2d02-4372-a2a6-90c7d76910ba,1970-12-26 00:00:00,2024-04-07 00:00:00,Sign suffer body decision enjoy television college.,EMP_296,Approved,0
660f8d63cf56a208f379b952,Arduino,Moody LLC,12b5d3b7-1521-49a1-899d-3d98f6e938b2,1993-04-01 00:00:00,2024-05-01 00:00:00,Student produce responsibility high mention available.,EMP_297,Rejected,0
660f8d63cf56a208f379b953,Jenkins,"Carter, Hunter and Zamora",cf2ff279-9f4a-42b6-8158-027c8d38940d,2007-08-19 00:00:00,2024-04-28 00:00:00,Board those plan human painting sound rise.,EMP_298,Rejected,0
660f8d63cf56a208f379b954,Android Studio,Sanders LLC,21054ec0-e257-4ee2-a6dd-58e5b261afa5,2007-12-19 00:00:00,2024-04-14 00:00:00,Same or Mrs add.,EMP_299,Rejected,0
660f8d63cf56a208f379b955,Communication Skills,"Mcdonald, Banks and Arias",ade77cf7-b2b6-41b9-b081-7957b493fc16,1970-01-04 00:00:00,2024-05-04 00:00:00,Nice record ever adult executive evidence smile.,EMP_300,Rejected,0
660f8d63cf56a208f379b956,Spark),Bennett and Sons,6d6ad502-836b-46cf-b119-db368d1b9ddc,2011-01-20 00:00:00,2024-04-13 00:00:00,Police program among hand cause sell four.,EMP_301,Rejected,0
660f8d63cf56a208f379b957,PyTorch,Kennedy-Perry,f2ca7b80-0379-495c-aed6-51c2f32a9ba7,2009-04-18 00:00:00,2024-04-07 00:00:00,Policy call a model.,EMP_302,Rejected,0
660f8d63cf56a208f379b958,Customer Service Skills,Page Group,c67ec480-2b2a-4a5b-8dcf-1cb9592febf8,2000-02-18 00:00:00,2024-04-23 00:00:00,Time Republican another claim bank.,EMP_303,Rejected,0
660f8d63cf56a208f379b959,Research Skills,Ramirez LLC,1786e4d5-4224-4129-8b88-166789933b2a,2016-08-09 00:00:00,2024-04-24 00:00:00,Talk exactly imagine beautiful activity plant.,EMP_304,Approved,0
660f8d63cf56a208f379b95a,Technical Proficiency (specific to the employee's field),"Clark, Thomas and Crawford",65fdb820-7caa-43f3-88dd-be696a7304e3,1994-06-25 00:00:00,2024-04-10 00:00:00,Peace school participant last.,EMP_305,Rejected,0
660f8d63cf56a208f379b95b,Android Studio,Keller-Jones,9feb2dd9-2325-4dec-9c2c-be7a042f76c7,1977-07-29 00:00:00,2024-04-06 00:00:00,Guy federal nothing right news dinner.,EMP_306,Rejected,0
660f8d63cf56a208f379b95c,MongoDB,Jordan-Mendoza,ad63cf21-0472-49de-bab5-6297637d36f5,1975-02-23 00:00:00,2024-04-24 00:00:00,Democrat surface blood risk Mr laugh.,EMP_307,Approved,0
660f8d63cf56a208f379b95d,Xcode,Garcia-Garcia,17058e5a-9912-4f5d-8e3e-6f229e8151a3,2004-04-25 00:00:00,2024-04-12 00:00:00,Avoid form population live attorney can society.,EMP_308,Approved,0
660f8d63cf56a208f379b95e,Xcode,Moore and Sons,9934016b-0dae-4d52-a97d-0abf13f62e0c,1997-09-07 00:00:00,2024-04-07 00:00:00,Everyone month according develop final conference show table.,EMP_309,Approved,0
660f8d63cf56a208f379b95f,Selenium,Costa PLC,001f33f2-5f5a-47df-a257-fd1449328f5d,1989-07-03 00:00:00,2024-04-20 00:00:00,Task action make lot style determine.,EMP_310,Approved,0
660f8d63cf56a208f379b960,MongoDB,"Ryan, Goodman and Waters",21451084-a25f-45f2-baf8-e1be408c1644,2001-06-14 00:00:00,2024-04-10 00:00:00,Lead art such level part bill.,EMP_311,Approved,0
660f8d63cf56a208f379b961,Docker,Pearson LLC,fdb8405b-e2d0-4c5b-b674-544bd6c7569a,1973-10-25 00:00:00,2024-04-27 00:00:00,Decide hotel Mr place.,EMP_312,Rejected,0
660f8d63cf56a208f379b962,HTML/CSS,Duffy Ltd,393126cf-da77-42ed-8bcf-e611c697854b,2020-07-04 00:00:00,2024-04-18 00:00:00,Nothing film cell whatever.,EMP_313,Approved,0
660f8d63cf56a208f379b963,MySQL,Gross Group,69f43c6d-d917-4651-9e8a-c2ee8df7480e,1988-05-18 00:00:00,2024-04-11 00:00:00,It agency dinner I about relate newspaper face.,EMP_314,Approved,0
660f8d63cf56a208f379b964,MySQL,Chambers-Howard,3665650a-490f-4458-967e-d6711dd18515,1990-12-03 00:00:00,2024-04-19 00:00:00,White respond imagine call.,EMP_315,Approved,0
660f8d63cf56a208f379b965,Docker,Taylor-Morris,018a28e2-0535-46d5-9b75-54b21ec337e9,1993-04-14 00:00:00,2024-05-03 00:00:00,Country exactly operation when management be whom.,EMP_316,Approved,0
660f8d63cf56a208f379b966,Git,Tanner-Aguilar,882b20e1-0e62-4c4a-aa8d-c4de74c8ce01,1978-06-04 00:00:00,2024-04-21 00:00:00,Exactly believe behind picture.,EMP_317,Rejected,0
660f8d63cf56a208f379b967,AWS,"Smith, Wheeler and Sweeney",1b9ba529-7b75-4317-b3f5-04ef4709c156,2008-02-08 00:00:00,2024-04-18 00:00:00,Gas ever accept good share degree nearly brother.,EMP_318,Rejected,0
660f8d63cf56a208f379b968,Adaptability,Chang LLC,8b21dfc3-d0cb-4817-8872-c5ad7aa61b1c,2010-04-12 00:00:00,2024-05-02 00:00:00,Real beyond worry debate north stop pattern.,EMP_319,Approved,0
660f8d63cf56a208f379b969,Teamwork and Collaboration,French-Williams,e2710d49-0fab-42ac-9596-6785712b1033,1985-10-17 00:00:00,2024-04-25 00:00:00,Animal network medical deep discussion then lose care.,EMP_320,Rejected,0
660f8d63cf56a208f379b96a,Decision-Making Skills,"Bowers, Chambers and Garcia",4316cd0e-1d8c-46c5-99a5-2c1f94991bef,1995-03-24 00:00:00,2024-05-03 00:00:00,Hand three become doctor.,EMP_321,Rejected,0
660f8d63cf56a208f379b96b,Kotlin,"Young, Anderson and Harrington",b369d3f2-f067-47bb-8795-401559e26416,2011-06-09 00:00:00,2024-04-14 00:00:00,Because I project service.,EMP_322,Approved,0
660f8d63cf56a208f379b96c,Swift,Gonzalez-Davis,342be0b2-419e-44c2-99f2-7ca54d0f89d5,1984-09-30 00:00:00,2024-04-18 00:00:00,Whether city owner happen trial describe writer success.,EMP_323,Rejected,0
660f8d63cf56a208f379b96d,RESTful APIs,Duncan Ltd,0153e032-1b82-417e-a633-b63862498c07,1972-07-16 00:00:00,2024-04-07 00:00:00,Admit these machine her whatever.,EMP_324,Rejected,0
660f8d63cf56a208f379b96e,Teamwork and Collaboration,"Mcguire, Mahoney and Warren",f8e0e47b-be37-4ec6-84dc-89fdac2143a5,1978-08-05 00:00:00,2024-04-10 00:00:00,Control have industry hand.,EMP_325,Approved,0
660f8d63cf56a208f379b96f,Python,Edwards-Stevens,b23c4a2f-9bf0-46ee-a5c2-dc8598f51b12,2000-08-25 00:00:00,2024-04-11 00:00:00,Argue idea myself Congress already expect.,EMP_326,Approved,0
660f8d63cf56a208f379b970,TensorFlow,Levine-Garcia,b257feaa-3855-475a-b36f-9c66fa792412,2018-07-16 00:00:00,2024-04-20 00:00:00,Garden well another crime million.,EMP_327,Approved,0
660f8d63cf56a208f379b971,Selenium,"Miller, Atkins and Anderson",a1c7d923-c527-4f8c-b80f-1277a2c8cb1a,1977-11-03 00:00:00,2024-04-07 00:00:00,Condition more nothing social.,EMP_328,Approved,0
660f8d63cf56a208f379b972,Customer Service Skills,Weber PLC,98bf3516-0fed-438d-80d1-613b192a681f,1978-08-01 00:00:00,2024-04-06 00:00:00,Marriage develop identify five agent young.,EMP_329,Approved,0
660f8d63cf56a208f379b973,Kotlin,Page-Burgess,ef8e429a-dc57-4dad-9e56-3dfe5d5c8e91,2003-09-06 00:00:00,2024-04-12 00:00:00,Traditional inside son even challenge almost let.,EMP_330,Rejected,0
660f8d63cf56a208f379b974,Docker,Horton-Ray,77277bad-edf2-4a1d-a56e-c60aa8fbb564,1996-09-17 00:00:00,2024-04-13 00:00:00,Stock tax it improve term.,EMP_331,Approved,0
660f8d63cf56a208f379b975,Flask,Blankenship-Smith,f9e91ea4-22db-460d-99b1-3c7ef8384ed4,1997-08-11 00:00:00,2024-04-27 00:00:00,Politics tough arm.,EMP_332,Approved,0
660f8d63cf56a208f379b976,Adobe XD,Warren-Frost,d6e2a39c-59ce-4e4c-a446-1717c18f2a28,2002-02-16 00:00:00,2024-04-30 00:00:00,Close firm capital focus thing direction receive.,EMP_333,Approved,0
660f8d63cf56a208f379b977,Selenium,Price Group,01665d4e-1f53-479e-88cd-c2b58becf8dc,2006-12-30 00:00:00,2024-04-06 00:00:00,Rest current president arrive hotel opportunity.,EMP_334,Approved,0
660f8d63cf56a208f379b978,IoT Development,Jones-Johnson,770f38dc-1bcd-4b5b-a09e-ebe2f6ce31b1,1997-05-07 00:00:00,2024-04-25 00:00:00,Understand mind environmental head.,EMP_335,Rejected,0
660f8d63cf56a208f379b979,SQL,Smith-Barton,151b0a43-f1de-403a-9624-700f381c34ae,2023-01-06 00:00:00,2024-04-13 00:00:00,Often television teacher water six answer.,EMP_336,Rejected,0
660f8d63cf56a208f379b97a,Git,Franklin Inc,ccb58522-777c-4e63-8b55-def077b292f9,1980-04-29 00:00:00,2024-04-26 00:00:00,Value thought their evidence beat sell.,EMP_337,Approved,0
660f8d63cf56a208f379b97b,Spring Framework,Sharp Inc,9edbdced-12a6-4e8b-b0c5-a339cf83aac6,2016-05-28 00:00:00,2024-04-23 00:00:00,During center production range heart institution data sister.,EMP_338,Rejected,0
660f8d63cf56a208f379b97c,Project Management Skills,Collins-Swanson,4babfb05-2e2a-4665-8828-c556a085e223,2020-03-12 00:00:00,2024-04-26 00:00:00,Upon particularly leave star.,EMP_339,Rejected,0
660f8d63cf56a208f379b97d,Computer Vision,Paul Ltd,5abbec81-805a-4d7a-a881-6f2d0863c565,1974-01-20 00:00:00,2024-04-19 00:00:00,Item both Mrs return happen region improve.,EMP_340,Approved,0
660f8d63cf56a208f379b97e,Scikit-learn,Rivera Inc,7fa2b20f-8ce5-4a15-b321-b57cdda7ac21,2002-02-19 00:00:00,2024-04-15 00:00:00,Probably skill garden mother enough.,EMP_341,Approved,0
660f8d63cf56a208f379b97f,Python,Miller-Sanchez,bfdbc680-17e1-477b-8f17-0c5403b6cef2,2017-02-15 00:00:00,2024-04-06 00:00:00,Throughout center bit be side.,EMP_342,Rejected,0
660f8d63cf56a208f379b980,Spring Framework,"Reed, Hines and Hall",4ce15799-ca53-4f6d-a8f7-b4b9f2c17c11,2016-09-04 00:00:00,2024-04-15 00:00:00,Quite so former moment picture end.,EMP_343,Approved,0
660f8d63cf56a208f379b981,Customer Service Skills,Mason Ltd,8ddc8a50-0b4d-45bd-a03f-dbe233efb525,1999-02-17 00:00:00,2024-04-16 00:00:00,Near skin office choice stop energy.,EMP_344,Rejected,0
660f8d63cf56a208f379b982,RESTful APIs,"Carrillo, Medina and Pham",06d739a4-4267-4bf8-8019-035dd1f17ea8,1981-06-23 00:00:00,2024-05-01 00:00:00,Fall talk hour amount including finish hour.,EMP_345,Approved,0
660f8d63cf56a208f379b983,Attention to Detail,Williams-Kemp,281af588-6fdc-41f9-98c1-d85646d6f1bc,1978-02-22 00:00:00,2024-04-06 00:00:00,Market show resource sell magazine.,EMP_346,Approved,0
660f8d63cf56a208f379b984,Ethereum),Kelly PLC,ad39e5bc-6916-475b-ab62-8dbad89fbc16,2015-03-20 00:00:00,2024-04-09 00:00:00,Director wind challenge teacher article station local.,EMP_347,Approved,0
660f8d63cf56a208f379b985,Hibernate,Ward-Johnson,5288ea31-f1b9-4b8f-a928-d6e82ddeda7c,2009-02-22 00:00:00,2024-05-03 00:00:00,Chair area public imagine.,EMP_348,Rejected,0
660f8d63cf56a208f379b986,Figma,Davis Group,4eec3313-a214-4d07-9f0d-0733007e9adc,2012-06-23 00:00:00,2024-04-07 00:00:00,Management hot side second network lot write skin.,EMP_349,Rejected,0
660f8d63cf56a208f379b987,Attention to Detail,Jones Group,708d4afc-cd95-4ed2-9cee-172d045579a8,2004-12-18 00:00:00,2024-04-28 00:00:00,Five treatment always.,EMP_350,Rejected,0
660f8d63cf56a208f379b988,Git,"Williams, Sherman and Soto",840de9ea-1887-4e62-815e-7828feabf7eb,2015-07-24 00:00:00,2024-04-30 00:00:00,Mean month light administration partner.,EMP_351,Rejected,0
660f8d63cf56a208f379b989,Arduino,Daniels-Roberts,8fcb4ac3-0ca0-409e-b62d-e4bce7f39f12,2014-12-01 00:00:00,2024-04-08 00:00:00,Able history hour want blue phone edge.,EMP_352,Approved,0
660f8d63cf56a208f379b98a,Figma,Delgado-Bishop,6889a55e-85e2-464c-850a-e57910fac2aa,2019-08-04 00:00:00,2024-04-10 00:00:00,Various rather pattern language gas.,EMP_353,Rejected,0
660f8d63cf56a208f379b98b,Analytical Skills,Webb and Sons,b5f4f292-61ea-4eb8-af56-aefeb83de8a0,1970-06-01 00:00:00,2024-04-30 00:00:00,Institution entire decade.,EMP_354,Approved,0
660f8d63cf56a208f379b98c,Raspberry Pi,Collins PLC,d257834c-1d19-4c20-9f0f-2529ab0062f4,1974-07-19 00:00:00,2024-04-24 00:00:00,To fly race these.,EMP_355,Rejected,0
660f8d63cf56a208f379b98d,Kotlin,Rodriguez-Taylor,7e70a1c0-4082-484b-8cce-7d5a349ed7df,2014-07-26 00:00:00,2024-04-09 00:00:00,Relate rock region right grow.,EMP_356,Rejected,0
660f8d63cf56a208f379b98e,Networking Abilities,Henry PLC,aaf5191d-0c04-4888-a66b-dedee149bcbc,1978-01-15 00:00:00,2024-05-03 00:00:00,Southern certainly interesting.,EMP_357,Approved,0
660f8d63cf56a208f379b98f,Computer Vision,Macias Group,e30bcdae-2383-49d2-ba18-ff88f586bbc3,1987-04-25 00:00:00,2024-04-25 00:00:00,If trial network our program.,EMP_358,Rejected,0
660f8d63cf56a208f379b990,Flask,Castaneda Group,36b88cc8-6ee1-4b12-baf0-4c95b6f09f43,2010-11-11 00:00:00,2024-04-14 00:00:00,Feel enjoy hotel interview drug word.,EMP_359,Rejected,0
660f8d63cf56a208f379b991,JavaScript,Hebert PLC,35f7b39a-1f6e-489e-aa99-877ab49e4056,1998-02-17 00:00:00,2024-04-11 00:00:00,Himself form ten institution.,EMP_360,Rejected,0
660f8d63cf56a208f379b992,Kubernetes,"Jones, Turner and Hodges",abdc8893-4cc9-4d11-bf21-85c5c4e959da,1985-11-21 00:00:00,2024-04-13 00:00:00,Major chair agree test see.,EMP_361,Rejected,0
660f8d63cf56a208f379b993,AWS,"Dixon, Taylor and Vargas",5941d62f-b095-40b3-b417-553dc2fa037c,1980-04-09 00:00:00,2024-04-10 00:00:00,Job my court available for.,EMP_362,Approved,0
660f8d63cf56a208f379b994,Figma,Bennett-Ward,588230ea-3b99-4d5a-abdc-9ab57c260dbe,1995-01-24 00:00:00,2024-04-30 00:00:00,Difficult standard least admit reason should ahead team.,EMP_363,Approved,0
660f8d63cf56a208f379b995,JavaScript,Chandler-Davidson,5af95fdd-8744-4480-a482-22ef31c84493,1975-07-31 00:00:00,2024-04-09 00:00:00,Meet air somebody event coach.,EMP_364,Approved,0
660f8d63cf56a208f379b996,Git,"Mclean, Harrison and Evans",6636de33-b407-4a3b-bd78-90fd312a014c,2022-06-19 00:00:00,2024-04-06 00:00:00,Through behind painting and.,EMP_365,Approved,0
660f8d63cf56a208f379b997,Git,Harris-Manning,a2584064-dc6a-4ded-9ffb-b7aaa719c18c,2018-10-10 00:00:00,2024-04-11 00:00:00,Bar low culture station follow idea strategy.,EMP_366,Approved,0
660f8d63cf56a208f379b998,GraphQL,"Guerra, Pratt and Shea",eddf0f53-1f6a-45a2-a8be-64d2d4bc05ed,1978-02-20 00:00:00,2024-04-14 00:00:00,Trip without newspaper crime management light doctor especially.,EMP_367,Approved,0
660f8d63cf56a208f379b999,Analytical Skills,Wilson-Collins,9b3a39dd-a905-449a-8510-300fe0670c21,1985-03-01 00:00:00,2024-04-09 00:00:00,The mention hair look nation treat.,EMP_368,Rejected,0
660f8d63cf56a208f379b99a,AWS,Nelson-Friedman,71b7a007-7e68-454d-bfce-63e94aed1002,1976-11-16 00:00:00,2024-04-19 00:00:00,Glass energy several benefit.,EMP_369,Rejected,0
660f8d63cf56a208f379b99b,Oracle,Johnson-Hernandez,3a84b913-d770-43f8-bd10-a628bedf8f0c,1983-02-11 00:00:00,2024-04-17 00:00:00,Raise state ok add.,EMP_370,Approved,0
660f8d63cf56a208f379b99c,MongoDB,Bush LLC,846789db-6dee-4606-82a9-1dadf6530a8f,1997-04-14 00:00:00,2024-04-11 00:00:00,There law first lay would officer.,EMP_371,Approved,0
660f8d63cf56a208f379b99d,Research Skills,"Nguyen, Rasmussen and Carrillo",73af53d3-a30d-44e3-992a-49f891e49b9a,2017-04-11 00:00:00,2024-04-18 00:00:00,Operation within fine skill spend action manage.,EMP_372,Rejected,0
